{
  "watchlist_id": "asset-watchlist",
  "version": "2026.05.28.1",
  "effective_date": "2026-05-28",
  "purpose": "Repository-local allowlist of individual Mexican market assets permitted for future educational and technical monitoring, with S&P/BMV IPC retained only as a reference benchmark.",
  "assets": [
    {
      "symbol": "AMXL",
      "display_name": "America Movil, S.A.B. de C.V.",
      "market": {
        "venue": "Bolsa Mexicana de Valores",
        "country": "MX",
        "exchange_symbol": "AMXL",
        "index_membership": "S&P/BMV IPC constituent reference universe"
      },
      "asset_type": "equity",
      "asset_role": "monitoring_target",
      "currency": "MXN",
      "active": true,
      "notes": "Individual equity monitoring target; no prices or trading guidance captured.",
      "traceability": {
        "source_reference": "Public BMV issuer/listing and S&P/BMV IPC constituent reference materials; no market values captured.",
        "review_rationale": "Included as a well-known Mexican equity with clear BMV identifier for future monitoring scope.",
        "reviewed_by": "maintainer",
        "reviewed_at": "2026-05-28"
      }
    },
    {
      "symbol": "CEMEXCPO",
      "display_name": "Cemex, S.A.B. de C.V.",
      "market": {
        "venue": "Bolsa Mexicana de Valores",
        "country": "MX",
        "exchange_symbol": "CEMEXCPO",
        "index_membership": "S&P/BMV IPC constituent reference universe"
      },
      "asset_type": "equity",
      "asset_role": "monitoring_target",
      "currency": "MXN",
      "active": true,
      "notes": "Individual equity monitoring target; no prices or trading guidance captured.",
      "traceability": {
        "source_reference": "Public BMV issuer/listing and S&P/BMV IPC constituent reference materials; no market values captured.",
        "review_rationale": "Included as a well-known Mexican equity with clear BMV identifier for future monitoring scope.",
        "reviewed_by": "maintainer",
        "reviewed_at": "2026-05-28"
      }
    },
    {
      "symbol": "FEMSAUBD",
      "display_name": "Fomento Economico Mexicano, S.A.B. de C.V.",
      "market": {
        "venue": "Bolsa Mexicana de Valores",
        "country": "MX",
        "exchange_symbol": "FEMSAUBD",
        "index_membership": "S&P/BMV IPC constituent reference universe"
      },
      "asset_type": "equity",
      "asset_role": "monitoring_target",
      "currency": "MXN",
      "active": true,
      "notes": "Individual equity monitoring target; no prices or trading guidance captured.",
      "traceability": {
        "source_reference": "Public BMV issuer/listing and S&P/BMV IPC constituent reference materials; no market values captured.",
        "review_rationale": "Included as a well-known Mexican equity with clear BMV identifier for future monitoring scope.",
        "reviewed_by": "maintainer",
        "reviewed_at": "2026-05-28"
      }
    },
    {
      "symbol": "GMEXICOB",
      "display_name": "Grupo Mexico, S.A.B. de C.V.",
      "market": {
        "venue": "Bolsa Mexicana de Valores",
        "country": "MX",
        "exchange_symbol": "GMEXICOB",
        "index_membership": "S&P/BMV IPC constituent reference universe"
      },
      "asset_type": "equity",
      "asset_role": "monitoring_target",
      "currency": "MXN",
      "active": true,
      "notes": "Individual equity monitoring target; no prices or trading guidance captured.",
      "traceability": {
        "source_reference": "Public BMV issuer/listing and S&P/BMV IPC constituent reference materials; no market values captured.",
        "review_rationale": "Included as a well-known Mexican equity with clear BMV identifier for future monitoring scope.",
        "reviewed_by": "maintainer",
        "reviewed_at": "2026-05-28"
      }
    },
    {
      "symbol": "WALMEX",
      "display_name": "Wal-Mart de Mexico, S.A.B. de C.V.",
      "market": {
        "venue": "Bolsa Mexicana de Valores",
        "country": "MX",
        "exchange_symbol": "WALMEX*",
        "index_membership": "S&P/BMV IPC constituent reference universe"
      },
      "asset_type": "equity",
      "asset_role": "monitoring_target",
      "currency": "MXN",
      "active": true,
      "notes": "Local canonical symbol omits the exchange asterisk; exchange_symbol preserves the BMV identifier form.",
      "traceability": {
        "source_reference": "Public BMV issuer/listing and S&P/BMV IPC constituent reference materials; no market values captured.",
        "review_rationale": "Included as a well-known Mexican equity with clear BMV identifier for future monitoring scope.",
        "reviewed_by": "maintainer",
        "reviewed_at": "2026-05-28"
      }
    },
    {
      "symbol": "KOFUBL",
      "display_name": "Coca-Cola FEMSA, S.A.B. de C.V.",
      "market": {
        "venue": "Bolsa Mexicana de Valores",
        "country": "MX",
        "exchange_symbol": "KOFUBL",
        "index_membership": "S&P/BMV IPC constituent reference universe"
      },
      "asset_type": "equity",
      "asset_role": "monitoring_target",
      "currency": "MXN",
      "active": false,
      "notes": "Inactive validation fixture retained for snapshot status checks; no market values or trading guidance captured.",
      "traceability": {
        "source_reference": "Public BMV issuer/listing and S&P/BMV IPC constituent reference materials; no market values captured.",
        "review_rationale": "Retained as an inactive equity entry so local snapshot validation can demonstrate active-status rejection without adding runtime lookup behavior.",
        "reviewed_by": "maintainer",
        "reviewed_at": "2026-05-28"
      }
    },
    {
      "symbol": "IPC",
      "display_name": "S&P/BMV IPC",
      "market": {
        "venue": "Bolsa Mexicana de Valores",
        "country": "MX",
        "exchange_symbol": "IPC",
        "index_family": "S&P/BMV indices"
      },
      "asset_type": "index",
      "asset_role": "reference_benchmark",
      "currency": "MXN",
      "active": true,
      "notes": "Reference benchmark only; individual equity entries are the primary monitoring targets.",
      "traceability": {
        "source_reference": "BMV and S&P Dow Jones Indices public IPC index reference materials; no market values captured.",
        "review_rationale": "Included only to benchmark or contextualize future monitoring of the individual Mexican equity watchlist.",
        "reviewed_by": "maintainer",
        "reviewed_at": "2026-05-28"
      }
    }
  ]
}
